"","ID","logFC","logCPM","F","PValue","From","Entry","Reviewed","Entry.Name","Protein.names","Gene.Names","Function..CC.","Gene.Names..primary.","Gene.Ontology..GO.","Interacts.with","Subcellular.location..CC.","Ensembl","FDR"
"13383","NR2F2",1.25041806397153,7.11649608541738,62.389411711684,2.19592117843829e-12,"P24468","P24468","reviewed","COT2_HUMAN","COUP transcription factor 2 (COUP-TF2) (Apolipoprotein A-I regulatory protein 1) (ARP-1) (COUP transcription factor II) (COUP-TF II) (Nuclear receptor subfamily 2 group F member 2)","NR2F2 ARP1 TFCOUP2","FUNCTION: Ligand-activated transcription factor. Activated by high concentrations of 9-cis-retinoic acid and all-trans-retinoic acid, but not by dexamethasone, cortisol or progesterone (in vitro). Regulation of the apolipoprotein A-I gene transcription. Binds to DNA site A. May be required to establish ovary identity during early gonad development (PubMed:29478779). {ECO:0000269|PubMed:18798693, ECO:0000269|PubMed:1899293, ECO:0000269|PubMed:29478779, ECO:0000269|PubMed:9343308}.","NR2F2","cytosol [GO:0005829]; nucleoplasm [GO:0005654]; nucleus [GO:0005634]; DNA-binding transcription factor activity [GO:0003700]; nuclear receptor activity [GO:0004879]; protein homodimerization activity [GO:0042803]; retinoic acid binding [GO:0001972]; RNA polymerase II cis-regulatory region sequence-specific DNA binding [GO:0000978]; sequence-specific DNA binding [GO:0043565]; zinc ion binding [GO:0008270]; anatomical structure development [GO:0048856]; anterior/posterior pattern specification [GO:0009952]; blood vessel morphogenesis [GO:0048514]; cell differentiation [GO:0030154]; female gonad development [GO:0008585]; fertilization [GO:0009566]; forebrain development [GO:0030900]; interneuron migration [GO:1904936]; lymphatic endothelial cell fate commitment [GO:0060838]; maternal placenta development [GO:0001893]; negative regulation of cyclin-dependent protein serine/threonine kinase activity [GO:0045736]; negative regulation of DNA-templated transcription [GO:0045892]; negative regulation of endothelial cell migration [GO:0010596]; negative regulation of endothelial cell proliferation [GO:0001937]; negative regulation of transcription by RNA polymerase II [GO:0000122]; placenta blood vessel development [GO:0060674]; positive regulation of DNA-templated transcription [GO:0045893]; positive regulation of systemic arterial blood pressure [GO:0003084]; positive regulation of transcription by RNA polymerase II [GO:0045944]; radial pattern formation [GO:0009956]; regulation of transcription by RNA polymerase II [GO:0006357]; response to estradiol [GO:0032355]; skeletal muscle tissue development [GO:0007519]; trophoblast giant cell differentiation [GO:0060707]","Q13485","SUBCELLULAR LOCATION: Nucleus.","ENST00000394166.8 [P24468-1];ENST00000394171.6 [P24468-3];ENST00000421109.6 [P24468-2];ENST00000453270.2 [P24468-3];",4.29434345655392e-08
"13469","NUCB2",0.76567236900397,7.60345472553542,23.3656352309222,6.37010703273975e-06,"E9PJP3","E9PJP3","unreviewed","E9PJP3_HUMAN","Nucleobindin-2","NUCB2","","NUCB2","cellular anatomical entity [GO:0110165]; calcium ion binding [GO:0005509]; negative regulation of appetite [GO:0032099]","","","ENST00000526120.5;ENST00000533738.6;",0.00692076739623658
"13889","PCK2",-1.63907975097041,3.9760412055074,21.5078402873846,1.04098330708268e-05,"A0A384MTT2","A0A384MTT2","unreviewed","A0A384MTT2_HUMAN","Phosphoenolpyruvate carboxykinase (GTP) (EC 4.1.1.32)","PCK2 hCG_40169","","PCK2","mitochondrion [GO:0005739]; GTP binding [GO:0005525]; kinase activity [GO:0016301]; metal ion binding [GO:0046872]; phosphoenolpyruvate carboxykinase (GTP) activity [GO:0004613]; cellular response to glucose stimulus [GO:0071333]; cellular response to tumor necrosis factor [GO:0071356]; gluconeogenesis [GO:0006094]; NADH oxidation [GO:0006116]; oxaloacetate metabolic process [GO:0006107]; phosphorylation [GO:0016310]; positive regulation of insulin secretion [GO:0032024]; pyruvate metabolic process [GO:0006090]; response to dexamethasone [GO:0071548]; response to lipopolysaccharide [GO:0032496]","","","",0.00885107371882993
"13915","PDAP1",-0.966392148446583,6.33583616601632,25.1927558006114,3.88049735415817e-06,"F8WBW6","F8WBW6","unreviewed","F8WBW6_HUMAN","28 kDa heat- and acid-stable phosphoprotein","PDAP1","","PDAP1","","","","ENST00000426447.3;ENST00000626285.1;",0.00623103997071565
"13966","PDK1",1.22191952649787,4.40332142254506,21.4189255541433,1.00624897522285e-05,"Q15118","Q15118","reviewed","PDK1_HUMAN","[Pyruvate dehydrogenase (acetyl-transferring)] kinase isozyme 1, mitochondrial (EC 2.7.11.2) (Pyruvate dehydrogenase kinase isoform 1) (PDH kinase 1)","PDK1 PDHK1","FUNCTION: Kinase that plays a key role in regulation of glucose and fatty acid metabolism and homeostasis via phosphorylation of the pyruvate dehydrogenase subunits PDHA1 and PDHA2. This inhibits pyruvate dehydrogenase activity, and thereby regulates metabolite flux through the tricarboxylic acid cycle, down-regulates aerobic respiration and inhibits the formation of acetyl-coenzyme A from pyruvate. Plays an important role in cellular responses to hypoxia and is important for cell proliferation under hypoxia. Protects cells against apoptosis in response to hypoxia and oxidative stress. {ECO:0000269|PubMed:17683942, ECO:0000269|PubMed:18541534, ECO:0000269|PubMed:22195962, ECO:0000269|PubMed:7499431}.","PDK1","mitochondrial matrix [GO:0005759]; mitochondrial pyruvate dehydrogenase complex [GO:0005967]; mitochondrion [GO:0005739]; ATP binding [GO:0005524]; protein kinase activity [GO:0004672]; pyruvate dehydrogenase (acetyl-transferring) kinase activity [GO:0004740]; cell population proliferation [GO:0008283]; glucose metabolic process [GO:0006006]; hypoxia-inducible factor-1alpha signaling pathway [GO:0097411]; intrinsic apoptotic signaling pathway in response to oxidative stress [GO:0008631]; protein phosphorylation [GO:0006468]; regulation of acetyl-CoA biosynthetic process from pyruvate [GO:0010510]; regulation of glucose metabolic process [GO:0010906]","P05067; P08559; Q16513; P31749-1; P31751-1","SUBCELLULAR LOCATION: Mitochondrion matrix {ECO:0000269|PubMed:22195962}.","ENST00000282077.8 [Q15118-1];ENST00000392571.6 [Q15118-2];ENST00000410055.5 [Q15118-1];",0.00885107371882993
"14067","PGK1",0.62991574888147,9.83025401995819,27.6527036725783,7.11298079334407e-07,"P00558","P00558","reviewed","PGK1_HUMAN","Phosphoglycerate kinase 1 (EC 2.7.2.3) (Cell migration-inducing gene 10 protein) (Primer recognition protein 2) (PRP 2)","PGK1 PGKA MIG10 OK/SW-cl.110","FUNCTION: Catalyzes one of the two ATP producing reactions in the glycolytic pathway via the reversible conversion of 1,3-diphosphoglycerate to 3-phosphoglycerate (PubMed:30323285, PubMed:7391028). In addition to its role as a glycolytic enzyme, it seems that PGK-1 acts as a polymerase alpha cofactor protein (primer recognition protein) (PubMed:2324090). May play a role in sperm motility (PubMed:26677959). {ECO:0000269|PubMed:2324090, ECO:0000269|PubMed:26677959, ECO:0000269|PubMed:30323285, ECO:0000269|PubMed:7391028}.","PGK1","cytosol [GO:0005829]; extracellular exosome [GO:0070062]; extracellular space [GO:0005615]; membrane [GO:0016020]; membrane raft [GO:0045121]; ADP binding [GO:0043531]; ATP binding [GO:0005524]; phosphoglycerate kinase activity [GO:0004618]; protein-disulfide reductase (NAD(P)) activity [GO:0047134]; canonical glycolysis [GO:0061621]; cellular response to hypoxia [GO:0071456]; epithelial cell differentiation [GO:0030855]; gluconeogenesis [GO:0006094]; glycolytic process [GO:0006096]; negative regulation of angiogenesis [GO:0016525]; phosphorylation [GO:0016310]; plasminogen activation [GO:0031639]","P04406; O15379; Q8TDX7; P12004; O15379","SUBCELLULAR LOCATION: Cytoplasm.","ENST00000373316.5 [P00558-1];ENST00000644362.1 [P00558-2];",0.00278202904789273
"14665","PRELID3A",-2.12850535386293,2.97734014921543,20.9110993106115,1.25692125156023e-05,"Q96N28","Q96N28","reviewed","PLD3A_HUMAN","PRELI domain containing protein 3A (Protein slowmo homolog 1)","PRELID3A C18orf43 SLMO1","FUNCTION: In vitro, the TRIAP1:PRELID3A complex mediates the transfer of phosphatidic acid (PA) between liposomes and probably functions as a PA transporter across the mitochondrion intermembrane space. Phosphatidic acid import is required for cardiolipin (CL) synthesis in the mitochondrial inner membrane. {ECO:0000305|PubMed:26071602}.","PRELID3A","mitochondrial intermembrane space [GO:0005758]; phosphatidic acid transfer activity [GO:1990050]; phospholipid transport [GO:0015914]","","SUBCELLULAR LOCATION: Mitochondrion {ECO:0000305}.","ENST00000336990.8 [Q96N28-1];ENST00000440960.6 [Q96N28-1];ENST00000592149.5 [Q96N28-2];",0.0094539815367353
"15654","RPS21",-0.743867112061144,10.316539448692,25.906202939957,2.21147214988894e-06,"Q6FGH5","Q6FGH5","unreviewed","Q6FGH5_HUMAN","40S ribosomal protein S21","RPS21 hCG_41768","","RPS21","cytosol [GO:0005829]; ribosome [GO:0005840]; rough endoplasmic reticulum [GO:0005791]; synapse [GO:0045202]; structural constituent of ribosome [GO:0003735]; translation [GO:0006412]","","SUBCELLULAR LOCATION: Cytoplasm, cytosol {ECO:0000256|ARBA:ARBA00004514}. Endoplasmic reticulum {ECO:0000256|ARBA:ARBA00004240}. Rough endoplasmic reticulum {ECO:0000256|ARBA:ARBA00004427}.","",0.00506547536952206
"16425","SLC39A7",-0.732888881889402,6.63032723513524,22.6074320759331,6.00328734373769e-06,"Q92504","Q92504","reviewed","S39A7_HUMAN","Zinc transporter SLC39A7 (Histidine-rich membrane protein Ke4) (Really interesting new gene 5 protein) (Solute carrier family 39 member 7) (Zrt-, Irt-like protein 7) (ZIP7)","SLC39A7 HKE4 RING5","FUNCTION: Zinc transporter, that transports Zn(2+) from the endoplasmic reticulum/Golgi apparatus to the cytosol. Transport is stimulated by growth factors, such as EGF, and Ca(2+), as well as by exogenous Zn(2+). Has an essential role in B cell development and is required for proper B cell receptor signaling (PubMed:30718914). {ECO:0000269|PubMed:14525538, ECO:0000269|PubMed:15705588, ECO:0000269|PubMed:22317921, ECO:0000269|PubMed:30718914}.","SLC39A7","endoplasmic reticulum [GO:0005783]; endoplasmic reticulum membrane [GO:0005789]; Golgi apparatus [GO:0005794]; integral component of membrane [GO:0016021]; membrane [GO:0016020]; nucleoplasm [GO:0005654]; zinc ion transmembrane transporter activity [GO:0005385]; B cell differentiation [GO:0030183]; cellular zinc ion homeostasis [GO:0006882]; zinc ion transmembrane transport [GO:0071577]","Q13520; Q13323; Q9UGL9; P68400; P48165; Q9H3M0; Q8IUG1; Q6L8G8; Q9BYQ4; Q5T7P2; Q5T751; Q5T754; Q5TA81; Q5TA82; Q5TA78; Q5TCM9; Q5T871; Q9UGC6; Q6UXX9-2; Q3SXP7; O95436-2; P49901; O43610; Q9NUH8; Q9UBN6; Q86WB7-2; Q8WWY7","SUBCELLULAR LOCATION: Endoplasmic reticulum membrane {ECO:0000269|PubMed:14525538, ECO:0000269|PubMed:30718914}; Multi-pass membrane protein {ECO:0000255}. Golgi apparatus, cis-Golgi network membrane {ECO:0000269|PubMed:15705588}; Multi-pass membrane protein {ECO:0000255}.","ENST00000374675.7;ENST00000374677.8;ENST00000383213.8;ENST00000383214.8;ENST00000416369.6;ENST00000418477.6;ENST00000423043.6;ENST00000431735.6;ENST00000441854.6;ENST00000441953.6;ENST00000443773.6;ENST00000456261.6;",0.00692076739623658
"18769","WSB1",0.743117008503108,7.38266925612447,21.2112090764598,1.39875529533318e-05,"B4DGB8","B4DGB8","unreviewed","B4DGB8_HUMAN","WD repeat and SOCS box-containing protein 1 (cDNA FLJ58059, highly similar to WD repeat and SOCS box-containing protein 1)","WSB1","","WSB1","","","","ENST00000427287.6;",0.00946421470924808
"19028","ZHX1",0.727772676536399,7.38544434386812,26.2116428898172,1.29581570787746e-06,"Q9UKY1","Q9UKY1","reviewed","ZHX1_HUMAN","Zinc fingers and homeoboxes protein 1","ZHX1","FUNCTION: Acts as a transcriptional repressor. Increases DNMT3B-mediated repressive transcriptional activity when DNMT3B is tethered to DNA. May link molecule between DNMT3B and other co-repressor proteins. {ECO:0000269|PubMed:12237128}.","ZHX1","chromatin [GO:0000785]; nucleoplasm [GO:0005654]; nucleus [GO:0005634]; DNA binding [GO:0003677]; DNA-binding transcription factor activity [GO:0003700]; DNA-binding transcription factor activity, RNA polymerase II-specific [GO:0000981]; metal ion binding [GO:0046872]; protein heterodimerization activity [GO:0046982]; cell differentiation [GO:0030154]; negative regulation of DNA-templated transcription [GO:0045892]; negative regulation of transcription by RNA polymerase II [GO:0000122]; regulation of transcription by RNA polymerase II [GO:0006357]","P54253; Q9UBC3-1; P42858; Q9Y6X8; Q15326","SUBCELLULAR LOCATION: Nucleus {ECO:0000255|PROSITE-ProRule:PRU00108, ECO:0000269|PubMed:12237128, ECO:0000269|PubMed:17056598}. Note=Colocalized in the nucleus with DNMT3B.","ENST00000297857.3 [Q9UKY1-1];ENST00000395571.8 [Q9UKY1-1];ENST00000522655.5 [Q9UKY1-1];",0.00422349533054192
